{
  "catalog_version": "tsf_plugin_catalog_risk_v1",
  "baseline_state": "REVIEW_ONLY_REFERENCE_NOT_RUNTIME_ENFORCED",
  "authority_boundary": "STATIC_NON_OPERATIONAL_NON_AUTHORITATIVE_HUMAN_DECISION_SUPPORT_ONLY",
  "source_notice": "All records are user-supplied, unverified seed data reconstructed after read-only source tracing. Reported DISCOVERED or AVAILABLE state is not a current host observation and implies no installation, enablement, connection, authentication, network access, load, invocation, action, or authority.",
  "runtime_observation_count": 0,
  "expected_counts": {
    "total": 36,
    "reported_available_not_installed": 8,
    "reported_discovered_installation_unknown": 28,
    "opaque_quarantined": 6
  },
  "plugins": [
    { "catalog_version": "tsf_plugin_catalog_risk_v1", "plugin_id": "alpaca", "display_name": "Alpaca", "source": "USER_SUPPLIED_SEED_AND_PARKED_STATIC_TRACE", "source_quality": "USER_SUPPLIED_UNVERIFIED", "source_confidence": "USER_SUPPLIED_UNVERIFIED", "reported_discovery_state": "DISCOVERED", "reported_installation_state": "UNKNOWN", "classification": "OPAQUE_QUARANTINED", "sensitivity": "OPAQUE_IDENTITY", "risk_tier": "UNKNOWN", "likely_capability_categories": null, "likely_surfaces": null, "project_relevance": "UNKNOWN", "overlap_groups": null, "quarantine_state": "QUARANTINED_PENDING_IDENTITY", "quarantine_reason": "Identity, publisher, version, manifest, permissions, and capability are unverified.", "approval_expectation": "IDENTITY_AND_PERMISSION_REVIEW_REQUIRED_NO_APPROVAL_GRANTED", "operational_verification_state": "UNVERIFIED_NO_RUNTIME_OBSERVATION", "publisher": null, "version": null, "manifest_sha256": null, "permission_scopes": null, "authentication_requirements": null, "connection_state": "UNKNOWN", "network_requirements": null, "host_availability": "UNKNOWN", "current_enablement": "UNKNOWN", "capability_probe_status": "UNKNOWN", "authority_granted": false, "runtime_observations": [], "notes": "Quarantined static seed; no identity or operation is inferred.", "last_reviewed_at": "2026-07-13" },
    { "catalog_version": "tsf_plugin_catalog_risk_v1", "plugin_id": "browser", "display_name": "Browser", "source": "USER_SUPPLIED_SEED_AND_PARKED_STATIC_TRACE", "source_quality": "USER_SUPPLIED_UNVERIFIED", "source_confidence": "USER_SUPPLIED_UNVERIFIED", "reported_discovery_state": "DISCOVERED", "reported_installation_state": "UNKNOWN", "classification": "TSF_CORE_OPTIONAL_CANDIDATE", "sensitivity": "PUBLIC_RESEARCH_CONTEXT_DEPENDENT", "risk_tier": "UNKNOWN", "likely_capability_categories": ["public_research", "structured_browser_control"], "likely_surfaces": null, "project_relevance": "POTENTIAL_PUBLIC_RESEARCH_SUPPORT", "overlap_groups": ["BROWSER_CONTROL"], "quarantine_state": "NOT_QUARANTINED_BY_STATIC_BASELINE", "quarantine_reason": null, "approval_expectation": "HUMAN_METADATA_REVIEW_REQUIRED_NO_APPROVAL_GRANTED", "operational_verification_state": "UNVERIFIED_NO_RUNTIME_OBSERVATION", "publisher": null, "version": null, "manifest_sha256": null, "permission_scopes": null, "authentication_requirements": null, "connection_state": "UNKNOWN", "network_requirements": null, "host_availability": "UNKNOWN", "current_enablement": "UNKNOWN", "capability_probe_status": "UNKNOWN", "authority_granted": false, "runtime_observations": [], "notes": "Likely categories are static review labels, not verified capabilities.", "last_reviewed_at": "2026-07-13" },
    { "catalog_version": "tsf_plugin_catalog_risk_v1", "plugin_id": "canva", "display_name": "Canva", "source": "USER_SUPPLIED_SEED_AND_PARKED_STATIC_TRACE", "source_quality": "USER_SUPPLIED_UNVERIFIED", "source_confidence": "USER_SUPPLIED_UNVERIFIED", "reported_discovery_state": "DISCOVERED", "reported_installation_state": "UNKNOWN", "classification": "PROJECT_SPECIFIC_CANDIDATE", "sensitivity": "PROJECT_CONTEXT_DEPENDENT", "risk_tier": "UNKNOWN", "likely_capability_categories": ["canva_design"], "likely_surfaces": null, "project_relevance": "POTENTIAL_DESIGN_ARTIFACT_WORK", "overlap_groups": ["ARTIFACT_DESIGN"], "quarantine_state": "NOT_QUARANTINED_BY_STATIC_BASELINE", "quarantine_reason": null, "approval_expectation": "PROJECT_SPECIFIC_HUMAN_REVIEW_REQUIRED_NO_APPROVAL_GRANTED", "operational_verification_state": "UNVERIFIED_NO_RUNTIME_OBSERVATION", "publisher": null, "version": null, "manifest_sha256": null, "permission_scopes": null, "authentication_requirements": null, "connection_state": "UNKNOWN", "network_requirements": null, "host_availability": "UNKNOWN", "current_enablement": "UNKNOWN", "capability_probe_status": "UNKNOWN", "authority_granted": false, "runtime_observations": [], "notes": "Likely category is a static review label, not a verified capability.", "last_reviewed_at": "2026-07-13" },
    { "catalog_version": "tsf_plugin_catalog_risk_v1", "plugin_id": "chrome", "display_name": "Chrome", "source": "USER_SUPPLIED_SEED_AND_PARKED_STATIC_TRACE", "source_quality": "USER_SUPPLIED_UNVERIFIED", "source_confidence": "USER_SUPPLIED_UNVERIFIED", "reported_discovery_state": "DISCOVERED", "reported_installation_state": "UNKNOWN", "classification": "SENSITIVE_CONNECTOR_MISSION_ONLY", "sensitivity": "AUTHENTICATED_SESSION_SENSITIVE", "risk_tier": "UNKNOWN", "likely_capability_categories": ["authenticated_session_browser"], "likely_surfaces": null, "project_relevance": "POTENTIAL_EXACT_MISSION_AUTHENTICATED_BROWSER_REVIEW", "overlap_groups": ["BROWSER_CONTROL"], "quarantine_state": "NOT_QUARANTINED_BY_STATIC_BASELINE", "quarantine_reason": null, "approval_expectation": "EXACT_MISSION_HUMAN_REVIEW_REQUIRED_NO_APPROVAL_GRANTED", "operational_verification_state": "UNVERIFIED_NO_RUNTIME_OBSERVATION", "publisher": null, "version": null, "manifest_sha256": null, "permission_scopes": null, "authentication_requirements": null, "connection_state": "UNKNOWN", "network_requirements": null, "host_availability": "UNKNOWN", "current_enablement": "UNKNOWN", "capability_probe_status": "UNKNOWN", "authority_granted": false, "runtime_observations": [], "notes": "Authenticated-session access is sensitive; no session or connection is claimed.", "last_reviewed_at": "2026-07-13" },
    { "catalog_version": "tsf_plugin_catalog_risk_v1", "plugin_id": "cloudflare", "display_name": "Cloudflare", "source": "USER_SUPPLIED_SEED_AND_PARKED_STATIC_TRACE", "source_quality": "USER_SUPPLIED_UNVERIFIED", "source_confidence": "USER_SUPPLIED_UNVERIFIED", "reported_discovery_state": "DISCOVERED", "reported_installation_state": "UNKNOWN", "classification": "PROJECT_SPECIFIC_CANDIDATE", "sensitivity": "PROJECT_AND_EXTERNAL_PLATFORM_DEPENDENT", "risk_tier": "UNKNOWN", "likely_capability_categories": ["cloudflare_platform"], "likely_surfaces": null, "project_relevance": "POTENTIAL_CLOUDFLARE_PROJECT_WORK", "overlap_groups": null, "quarantine_state": "NOT_QUARANTINED_BY_STATIC_BASELINE", "quarantine_reason": null, "approval_expectation": "PROJECT_SPECIFIC_HUMAN_REVIEW_REQUIRED_NO_APPROVAL_GRANTED", "operational_verification_state": "UNVERIFIED_NO_RUNTIME_OBSERVATION", "publisher": null, "version": null, "manifest_sha256": null, "permission_scopes": null, "authentication_requirements": null, "connection_state": "UNKNOWN", "network_requirements": null, "host_availability": "UNKNOWN", "current_enablement": "UNKNOWN", "capability_probe_status": "UNKNOWN", "authority_granted": false, "runtime_observations": [], "notes": "Likely category is a static review label, not a verified capability.", "last_reviewed_at": "2026-07-13" },
    { "catalog_version": "tsf_plugin_catalog_risk_v1", "plugin_id": "computer-use", "display_name": "Computer Use", "source": "USER_SUPPLIED_SEED_AND_PARKED_STATIC_TRACE", "source_quality": "USER_SUPPLIED_UNVERIFIED", "source_confidence": "USER_SUPPLIED_UNVERIFIED", "reported_discovery_state": "DISCOVERED", "reported_installation_state": "UNKNOWN", "classification": "SENSITIVE_CONNECTOR_MISSION_ONLY", "sensitivity": "HIGH_RISK_UI_CONTROL", "risk_tier": "UNKNOWN", "likely_capability_categories": ["unstructured_desktop_control"], "likely_surfaces": null, "project_relevance": "POTENTIAL_LAST_RESORT_EXACT_MISSION_REVIEW", "overlap_groups": ["BROWSER_CONTROL"], "quarantine_state": "NOT_QUARANTINED_BY_STATIC_BASELINE", "quarantine_reason": null, "approval_expectation": "EXACT_MISSION_LAST_RESORT_HUMAN_REVIEW_REQUIRED_NO_APPROVAL_GRANTED", "operational_verification_state": "UNVERIFIED_NO_RUNTIME_OBSERVATION", "publisher": null, "version": null, "manifest_sha256": null, "permission_scopes": null, "authentication_requirements": null, "connection_state": "UNKNOWN", "network_requirements": null, "host_availability": "UNKNOWN", "current_enablement": "UNKNOWN", "capability_probe_status": "UNKNOWN", "authority_granted": false, "runtime_observations": [], "notes": "Broad UI control is a last-resort review concern; no control capability is verified.", "last_reviewed_at": "2026-07-13" },